{
  "schemaVersion": 1,
  "runId": "fixture-missing-cleanup",
  "generatedAt": "2026-07-26T10:00:00.000Z",
  "baselineTag": "v2.19.0",
  "candidate": {
    "developCommit": "aaaaaaaaaaaaaaaaaaaaaaaaaaaaaaaaaaaaaaaa",
    "candidateTreeDigest": "bbbbbbbbbbbbbbbbbbbbbbbbbbbbbbbbbbbbbbbb",
    "previewUrl": "https://preview.example.test/",
    "previewIdentity": "aaaaaaaaaaaaaaaaaaaaaaaaaaaaaaaaaaaaaaaa"
  },
  "obligations": [],
  "results": [{
    "scenarioId": "studio.config-persistence",
    "environment": "local-contract",
    "status": "passed",
    "startedAt": "2026-07-26T10:01:00.000Z",
    "finishedAt": "2026-07-26T10:01:01.000Z",
    "runner": "playwright",
    "evidence": {
      "ui": ["artifacts/studio.png"],
      "http": ["artifacts/studio.json"],
      "datastore": ["artifacts/studio-row.json"],
      "cleanup": ["artifacts/studio-residue.json"]
    },
    "fixtures": [{
      "id": "fixture-missing-cleanup-studio",
      "cleanupStatus": "present",
      "residueEvidence": ""
    }]
  }],
  "exceptions": [],
  "manualObligations": [],
  "exploratoryCharters": [],
  "rollbackReference": "docs/runbooks/rollback.md",
  "tagAuthorization": { "status": "pending" }
}
